{
  "schemaVersion": "1",
  "rulesetId": "cloudshield-grc",
  "version": "2026.10.0",
  "lastReviewed": "2026-10-16",
  "disclaimer": "Informational mapping prepared for an academic capstone (CloudShield). It is not legal advice and does not establish compliance. Items marked \"verify\" have not been checked against the official text; confirm every obligation with qualified counsel and the regulator's own publications before relying on it. Last reviewed 2026-10-16.",
  "jurisdictions": [
    {
      "id": "EG",
      "name": "Egypt",
      "frameworks": [
        "EG-PDPL",
        "EG-CBE"
      ]
    },
    {
      "id": "EU",
      "name": "European Union",
      "frameworks": [
        "EU-GDPR"
      ]
    },
    {
      "id": "SA",
      "name": "Saudi Arabia",
      "frameworks": [
        "SA-PDPL",
        "SA-NCA"
      ]
    }
  ],
  "regionCountry": {
    "us-east-1": "US",
    "us-east-2": "US",
    "us-west-2": "US",
    "eu-central-1": "EU",
    "eu-west-1": "EU",
    "eu-west-3": "EU",
    "eu-south-1": "EU",
    "eu-north-1": "EU",
    "me-central-1": "AE",
    "me-south-1": "BH",
    "il-central-1": "IL",
    "af-south-1": "ZA"
  },
  "frameworks": [
    {
      "id": "EG-PDPL",
      "title": "Egypt Personal Data Protection Law",
      "citation": "Law No. 151 of 2020",
      "regulator": "Personal Data Protection Center",
      "citationStatus": "doc",
      "notes": "The law's identity is checked; article-level content and the Executive Regulations are marked verify."
    },
    {
      "id": "EG-CBE",
      "title": "Central Bank of Egypt cloud, outsourcing and cybersecurity rules",
      "citation": "CBE instruments to be identified from CBE publications",
      "regulator": "Central Bank of Egypt",
      "citationStatus": "verify",
      "notes": "Instrument names, dates and article numbers are not established here."
    },
    {
      "id": "EU-GDPR",
      "title": "General Data Protection Regulation",
      "citation": "Regulation (EU) 2016/679",
      "regulator": "EU/EEA supervisory authorities",
      "citationStatus": "doc"
    },
    {
      "id": "SA-PDPL",
      "title": "Saudi Personal Data Protection Law",
      "citation": "Royal Decree No. M/19 (1443H)",
      "regulator": "Saudi Data & AI Authority (SDAIA)",
      "citationStatus": "doc",
      "notes": "The decree is checked; amendments, dates, transfer and breach rules are marked verify."
    },
    {
      "id": "SA-NCA",
      "title": "NCA Essential and Cloud Cybersecurity Controls",
      "citation": "ECC-2:2024; CCC",
      "regulator": "National Cybersecurity Authority",
      "citationStatus": "verify"
    }
  ],
  "rules": [
    {
      "id": "EG-PDPL-SCOPE-CBE",
      "framework": "EG-PDPL",
      "topic": "scope",
      "appliesWhen": {
        "all": [
          {
            "fact": "tenant.jurisdictions",
            "op": "includes",
            "value": "EG"
          },
          {
            "fact": "tenant.cbeRegulated",
            "op": "eq",
            "value": true
          }
        ]
      },
      "obligation": "Personal data held by the Central Bank of Egypt and by entities under its supervision is largely excluded from the PDPL; the banking laws and CBE rules apply instead.",
      "citations": [
        {
          "source": "Egypt Personal Data Protection Law, Law No. 151 of 2020",
          "article": "Art. 3",
          "status": "verify"
        }
      ],
      "assessment": {
        "type": "info"
      },
      "controls": [],
      "rationale": {
        "INFO": "The tenant is CBE-regulated: review the CBE rules (EG-CBE) first; PDPL obligations may apply only in part.",
        "NOT_APPLICABLE": "Not CBE-regulated."
      }
    },
    {
      "id": "EG-PDPL-LAWFUL-BASIS-CONSENT",
      "framework": "EG-PDPL",
      "topic": "lawful-basis",
      "appliesWhen": {
        "all": [
          {
            "fact": "tenant.jurisdictions",
            "op": "includes",
            "value": "EG"
          },
          {
            "fact": "tenant.processesPersonalData",
            "op": "eq",
            "value": true
          }
        ]
      },
      "obligation": "Process personal data only with the data subject's consent or another basis the law allows, for a specific and legitimate purpose.",
      "citations": [
        {
          "source": "Egypt Personal Data Protection Law, Law No. 151 of 2020",
          "article": "Art. 6",
          "status": "verify"
        }
      ],
      "assessment": {
        "type": "customer-action"
      },
      "controls": [],
      "rationale": {
        "CUSTOMER_ACTION": "The lawful basis is the controller's (tenant's) decision; CloudShield processes documents on the tenant's instructions."
      }
    },
    {
      "id": "EG-PDPL-BREACH-NOTICE",
      "framework": "EG-PDPL",
      "topic": "breach-notification",
      "appliesWhen": {
        "all": [
          {
            "fact": "tenant.jurisdictions",
            "op": "includes",
            "value": "EG"
          },
          {
            "fact": "tenant.processesPersonalData",
            "op": "eq",
            "value": true
          }
        ]
      },
      "obligation": "Notify the Personal Data Protection Center of a personal data breach within 72 hours, and the affected data subjects within a short period after.",
      "parameters": {
        "deadlineHours": 72
      },
      "citations": [
        {
          "source": "Egypt Personal Data Protection Law, Law No. 151 of 2020",
          "article": "Art. 7",
          "status": "verify"
        }
      ],
      "assessment": {
        "type": "platform-control",
        "metWhen": {
          "all": [
            {
              "fact": "platform.breachNotificationTooling",
              "op": "eq",
              "value": "sns-chatops"
            },
            {
              "fact": "platform.incidentAutomation",
              "op": "eq",
              "value": "enabled"
            }
          ]
        },
        "partialWhen": {
          "fact": "platform.breachNotificationTooling",
          "op": "eq",
          "value": "sns-chatops"
        }
      },
      "controls": [
        "soar.mttc",
        "soar.ir-report",
        "chatops.notify"
      ],
      "rationale": {
        "MET": "Detection, automated containment (MTTC target 60 s), SNS/ChatOps alerting and IR reports give the evidence needed for the notice. Sending the notice to the authority remains the controller's act.",
        "PARTIAL": "Alerting and IR reports exist, but automated containment is in dry-run or disabled: incident timelines depend on analysts. Sending the notice remains the controller's act.",
        "GAP": "No breach alerting path is configured."
      }
    },
    {
      "id": "EG-PDPL-DPO",
      "framework": "EG-PDPL",
      "topic": "dpo",
      "appliesWhen": {
        "all": [
          {
            "fact": "tenant.jurisdictions",
            "op": "includes",
            "value": "EG"
          },
          {
            "fact": "tenant.processesPersonalData",
            "op": "eq",
            "value": true
          }
        ]
      },
      "obligation": "Appoint a data protection officer where the law requires it and register them with the Center.",
      "citations": [
        {
          "source": "Egypt Personal Data Protection Law, Law No. 151 of 2020",
          "article": "Art. 8–9",
          "status": "verify"
        }
      ],
      "assessment": {
        "type": "customer-action"
      },
      "controls": [],
      "rationale": {
        "CUSTOMER_ACTION": "Appointing and registering a DPO is the controller's duty."
      }
    },
    {
      "id": "EG-PDPL-CROSS-BORDER",
      "framework": "EG-PDPL",
      "topic": "cross-border",
      "appliesWhen": {
        "all": [
          {
            "fact": "tenant.jurisdictions",
            "op": "includes",
            "value": "EG"
          },
          {
            "fact": "tenant.processesPersonalData",
            "op": "eq",
            "value": true
          }
        ]
      },
      "obligation": "Transfer personal data outside Egypt only to a destination with an adequate level of protection, and with a licence or permit from the Center.",
      "citations": [
        {
          "source": "Egypt Personal Data Protection Law, Law No. 151 of 2020",
          "article": "Art. 14–15",
          "status": "verify"
        }
      ],
      "assessment": {
        "type": "platform-control",
        "metWhen": {
          "fact": "derived.crossBorder",
          "op": "eq",
          "value": false
        }
      },
      "controls": [
        "platform.region"
      ],
      "rationale": {
        "MET": "Hosted in Egypt.",
        "GAP": "Data is hosted in {deploymentRegions} ({deploymentCountries}): every request is a transfer outside Egypt. Multi-region deployment is out of the capstone scope."
      }
    },
    {
      "id": "EG-PDPL-LICENSING",
      "framework": "EG-PDPL",
      "topic": "licensing",
      "appliesWhen": {
        "all": [
          {
            "fact": "tenant.jurisdictions",
            "op": "includes",
            "value": "EG"
          },
          {
            "fact": "tenant.processesPersonalData",
            "op": "eq",
            "value": true
          }
        ]
      },
      "obligation": "Controllers and processors obtain the licence or permit the Center issues before processing.",
      "citations": [
        {
          "source": "Egypt Personal Data Protection Law, Law No. 151 of 2020",
          "article": "licensing provisions",
          "status": "verify"
        }
      ],
      "assessment": {
        "type": "customer-action"
      },
      "controls": [],
      "rationale": {
        "CUSTOMER_ACTION": "Both the tenant (controller) and the operator (processor) need the Center's licence or permit; status not tracked by CloudShield."
      }
    },
    {
      "id": "EG-PDPL-SENSITIVE-DATA",